{
  "record_type": "university_raw",
  "is_test_fixture": true,
  "university": {
    "internal_id": "test-harvard",
    "unitid": "166027",
    "official_name": "Harvard University",
    "name_zh": "哈佛大学",
    "official_website": "https://www.harvard.edu/",
    "institution_type": "university",
    "control_type": "private_nonprofit",
    "city": "Cambridge",
    "state": "Massachusetts",
    "state_code": "MA",
    "latitude": 42.377,
    "longitude": -71.1167,
    "selection_reason": "national_top_50"
  },
  "source": {
    "source_id": "test-source-harvard",
    "url": "https://example.invalid/test-harvard",
    "publisher": "PathOS test fixture",
    "page_title": "Test fixture only",
    "source_type": "test_fixture",
    "accessed_at": "2026-07-10T00:00:00Z",
    "status": "test_only"
  },
  "frontend_fields": {
    "rankingBand": "National Top 50 (test)",
    "rankingTier": "top50",
    "annualCostRmb": 580000,
    "safetyScore": 78,
    "recognitionScore": 98,
    "chineseCommunity": "high",
    "directFlight": true,
    "postStudyVisa": "OPT / STEM OPT",
    "programs": ["Computer Science"],
    "parentHighlights": ["test fixture only"],
    "studentHighlights": ["test fixture only"],
    "nearby": {
      "subwayStations": 0,
      "chineseRestaurants": 0,
      "asianGroceries": 0,
      "avgRentRmb": 0
    }
  }
}
